{
  "schema_version": "mncs.check-result/1",
  "id": "mncs-validation",
  "provider": "mncs-validator-rs",
  "verdict": "PASS",
  "scope": "specification",
  "summary": "Bundle valid.",
  "contract_revision": "0.2",
  "producer_revision": "abc123",
  "references": [
    {"kind": "contract-snapshot", "producer": "mncs-validator-rs", "contract_revision": "0.2", "path": "bundle/manifest.json", "digest": "aaaaaaaaaaaaaaaaaaaaaaaaaaaaaaaaaaaaaaaaaaaaaaaaaaaaaaaaaaaaaaaa"}
  ]
}
